Participant #,pattern1,pattern2,pattern3,recall1,recall2,recall3,guess1,guess2,guess3,guess4,guess5,guess6,guess7,guess8,guess9,guess10,q1,q2,q3,q3.exp,q4.expl,q5,q6,q7,q8
12,1.3.4.8,0.1.2.4.7,0.1.2.5.7.6,0.1.2.4.7,0.1.2.5.7.6,1.3.4.7,1.5.7.3,6.3.0.4.8.5.2,0.4.7.6.2,4.6.7.8.5.2,1.3.4.5.7.6,0.1.2.4.6.7.8,0.3.4.5.8,2.1.0.3.6.4.8,5.1.0.3.6.7.8,5.7.3.4,C,D,B,I would pick 4x4 because you still want your hone to be secure but easily accessible. This would allow a user the ease of locking.,I thought about what I would expect an average person to do. I thought about what patterns could be easily remembered and relate to everyday life as to not be forgotton.,B,A,A,B
0,0.4.6.7.8,1.4.7.6.2.5.8,1.3.7.5.4,0.3.6.7.8,1.4.7.6.2.5.8,1.3.7.5.4,0.4.8.5.2.6,2.4.6.7.8.0,0.3.6.7.4.5.8,8.5.2.1.0.3.6,4.5.2.1.0.3.6,3.1.5.8.7.6,0.1.2.5.8.7.6,6.4.2.5.8,7.3.1.5.4,0.1.2.5.8.7.6.3,A,A,B,More room for variation without being too big.,- Start in different. - Repeat same pattern in differnet rotations or flips.,B,A,B,B
11,0.4.8.5.2.1.7,6.3.0.4.2.5.7,6.3.4.5.8.0,6.3.0.4.2.5,6.4.1.2.5,6.3.0.1.2.5.8.7,0.3.4.7.8,4.8.5.2.1.0.3,7.4.1.0.3,2.1.0.3.6.7.8.5.4,0.3.4.7.6,6.7.4.1.0,8.7.4.5.2.1.0.3.6,1.3.7.5.8,7.6.3.4.1.2,8.7.6.3.4.1.0,A,A,A,I do not see the current grid size as problem. Anything layger would be an inconvenience to unlock.,I randomly selected patterns,B,B,A,B
5,4.3.2.7.6.5.8.0,2.3.1.6.5.8.4.0,7.3.1.2.4.6.5.8.0,2.3.7.5.6.8.4.0,4.6.7.8.3.2.5.0,4.8.3.2.7.5.0,0.3.6.4.2.5.8.7.1,1.0.3.7.5.2.4,2.1.3.7.8.5,0.3.6.1.8.5.2,1.3.7.6.4.2.5.8,2.1.3.7.5.4.0,1.5.8.7.6.3.2,6.3.0.4.2.5.8,0.4.8.5.2.6.1.7,0.4.8.5.3,C,B,B,"The bigger, the better unless its too hard for the owner to remember themselves that's why we should make it bigger but not too big, otherwise people will have to start using simpler codes which will be easier to guess.",Some I made simple like letters or shapes but other it was a lot of zig-zag lines (with no true strategy) except picking a circle (start position) that was a middle or corner circle.,B,B,B,B
8,3.0.4.1.5.8.7.6,2.5.4.1.0.3.6.7.8,0.1.2.5.8.7.6.3.4,0.4.1.5.8.7.6,2.5.4.1.0.3.6.7.8,4.1.0.3.6.7.8.5,0.4.8.5.2.6,2.5.8.7.6.3.0.1.4,0.4.8.7.6.2,4.1.2.5.8.7.6.3.0,0.3.6.7.8.5.2.4,1.3.7.5,8.4.2.5.3.0,7.4.1.5.3,2.5.1.4.3.0,6.4.2.1.0.8,A,A,D,"it would be more secure, and it wouldn't be easy to break. The fact of choosing a bigger grid ersuade other people that I'm using a difficult assword, and it doesn't neccessarily needs to be that way.",Easy passwords,B,B,B,A
9,6.3.0.1.4.7.8.5.2,1.4.7.8.5.2,0.3.6.4.7.8.5.2,2.1.0.3.6.7.8.5.4,0.3.6.7.4.1,3.6.4.7.8.5.2,0.3.6.7.8.5.2.4,2.5.4.7.6.3.0.1,0.1.2.5.8.7.6,0.3.4.5.8.7.6,0.3.1.4.2.5.8.7.6,8.7.3.1.2.5.4,0.3.4.5.8.7.6,4.0.1.2.5.8.7.6.3,4.1.2.5.8.7.6.3.0,0.3.6.4.2.5.8.7,C,C,A,"Small enough to remember, but difficult to guess--perfect for balance","I chose atterns that I would have used, simple but including a large number of dots",B,A,A,C
18,0.3.4.7.8.5.2.1,0.4.2.5.8.7,0.4.6.3.1.5.7,0.3.4.7.8.5.2.1,0.4.2.5.8.7.6,0.4.3.6.7.8.5.1,1.4.7.3.5,0.3.6.7.4.1.2.5.8,0.4.8.5.2.6,1.5.7.3.0,0.1.2.5.4.3.6.7.8,4.7.8.5.2.1.0.3.6,4.7.6.3.0.1.2.5.8,1.0.4.8.5.2,3.6.4.2,3.1.5.7,B,C,C,A bingo-sized grid is likely the maximum size I could reliably remember a pattern in,I guessed simple geometric desigs based off what I have used and seen others use,B,A,B,B
